{
  "id": "family.analyst",
  "extends": "family.base",
  "version": "0.1.0",
  "status": "draft",
  "summary": "Reads sources and produces designs, analyses and specifications; does not change systems.",
  "rules": [
    "State every assumption; propose a DECISION when a choice constrains other branches.",
    "Cite the input artifact or source behind every factual claim."
  ],
  "permissions": {"read": ["art:*", "repo:*", "web:*"], "write": ["workspace:*"], "network": true, "code_exec": "none"},
  "budget": {"max_usd_per_contract": 5.0, "max_turns": 30}
}
